{
  "$schema" : "http://json-schema.org/draft-07/schema#",
  "type" : "object",
  "properties" : {
    "@context" : {
      "type" : "array",
      "items" : {
        "type" : "string"
      }
    },
    "credentialSchema" : {
      "type" : "object",
      "properties" : {
        "id" : {
          "type" : "string"
        },
        "type" : {
          "type" : "string"
        }
      },
      "additionalProperties" : false
    },
    "credentialSubject" : {
      "type" : "object",
      "properties" : {
        "DNSpublicKey" : {
          "type" : "string"
        },
        "brandName" : {
          "type" : "string"
        },
        "commercialRegister" : {
          "type" : "object",
          "properties" : {
            "countryName" : {
              "type" : "string"
            },
            "locality" : {
              "type" : "string"
            },
            "organizationName" : {
              "type" : "string"
            },
            "organizationUnit" : {
              "type" : "string"
            },
            "postalCode" : {
              "type" : "string"
            },
            "streetAddress" : {
              "type" : "string"
            }
          },
          "additionalProperties" : false
        },
        "corporateEmailAddress" : {
          "type" : "string"
        },
        "ethereumAddress" : {
          "type" : "object",
          "properties" : {
            "id" : {
              "type" : "string"
            }
          },
          "additionalProperties" : false
        },
        "id" : {
          "type" : "string"
        },
        "individualContactLegal" : {
          "type" : "string"
        },
        "individualContactTechnical" : {
          "type" : "string"
        },
        "jurisdiction" : {
          "type" : "string"
        },
        "legalForm" : {
          "type" : "string"
        },
        "legalRegistrationNumber" : {
          "type" : "string"
        },
        "legallyBindingAddress" : {
          "type" : "object",
          "properties" : {
            "countryName" : {
              "type" : "string"
            },
            "locality" : {
              "type" : "string"
            },
            "postalCode" : {
              "type" : "string"
            },
            "streetAddress" : {
              "type" : "string"
            }
          },
          "additionalProperties" : false
        },
        "legallyBindingName" : {
          "type" : "string"
        },
        "trustState" : {
          "type" : "string"
        },
        "webAddress" : {
          "type" : "object",
          "properties" : {
            "url" : {
              "type" : "string"
            }
          },
          "additionalProperties" : false
        }
      },
      "additionalProperties" : false
    },
    "expirationDate" : {
      "type" : "string"
    },
    "id" : {
      "type" : "string"
    },
    "issuanceDate" : {
      "type" : "string"
    },
    "issued" : {
      "type" : "string"
    },
    "issuer" : {
      "type" : "string"
    },
    "proof" : {
      "type" : "object",
      "properties" : {
        "created" : {
          "type" : "string"
        },
        "creator" : {
          "type" : "string"
        },
        "domain" : {
          "type" : "string"
        },
        "jws" : {
          "type" : "string"
        },
        "nonce" : {
          "type" : "string"
        },
        "proofPurpose" : {
          "type" : "string"
        },
        "type" : {
          "type" : "string"
        },
        "verificationMethod" : {
          "type" : "string"
        }
      },
      "additionalProperties" : false
    },
    "type" : {
      "type" : "array",
      "items" : {
        "type" : "string"
      }
    },
    "validFrom" : {
      "type" : "string"
    }
  },
  "required" : [ "@context", "type" ],
  "additionalProperties" : false
}